{
  "monitor_id": "mon-001",
  "session_id": "sess-001",
  "sequence": 1,
  "status": "healthy",
  "active_panes": [
    "pane-1",
    "pane-2"
  ],
  "event_lag_ms": 15,
  "health_evidence": {
    "checks_passed": true,
    "checks": [
      "herdr_liveness",
      "pane_ledger"
    ],
    "last_ping": "2026-09-15T00:00:00Z",
    "evidence_hash": "sha256:279b986360e082dcc2136dfc5d29804f6ba1ee3e0ccdf8449612b07d4d7b94a3"
  },
  "timestamp": "2026-09-15T00:00:00Z"
}
